{
  "release_id": "DOMINION-COMMERCIAL-RELEASE-1.0",
  "release_objective": "A governed, secure, recoverable ecosystem capable of attracting a customer, converting that customer, receiving money, delivering the product or service, reconciling the money, attributing the sale, learning from the result, and repeating the cycle without manual rescue or governance drift.",
  "generated_at": "2026-09-15T17:23:30+00:00",
  "default_runtime_evidence_ttl_hours": 24,
  "allowed_progression": [
    "BUILT",
    "TESTED",
    "DEPLOYED",
    "RUNTIME_VERIFIED",
    "END_TO_END_PROVEN",
    "COMMERCIAL_OPERATIONAL_CERTIFIED"
  ],
  "components": [
    {
      "component_id": "release.lane01.truth-governance",
      "lane_id": 1,
      "owner": "Dominion Release Coordinator",
      "purpose": "Canonical truth, release authority, evidence, lifecycle, dependency and rollback control.",
      "location": "governance/commercial_release_1_0/closure_ledger.json",
      "engineering_state": "TESTED",
      "deployment_state": "NOT_APPLICABLE",
      "runtime_state": "UNVERIFIED",
      "customer_state": "NOT_APPLICABLE",
      "commercial_state": "UNVERIFIED",
      "security_state": "BLOCKED",
      "recovery_state": "UNVERIFIED",
      "release_stage": "BLOCKED",
      "dependencies": [],
      "deployed_sha_or_digest": null,
      "last_verified_at": "2026-09-15T06:33:47+00:00",
      "evidence_receipts": [
        {
          "receipt_id": "closure-ledger-pr326-merged",
          "kind": "immutable_release_control_receipt",
          "reference": "PR #326 merged at 01605e431980f6c073aa762e89fc6f4560be57a5 after exact-head CI and Five Council approval",
          "verified_at": "2026-09-15T06:33:47+00:00",
          "freshness": "IMMUTABLE",
          "expires_at": null
        },
        {
          "receipt_id": "github-main-protection-20260915T062618Z",
          "kind": "github_api_runtime_observation",
          "reference": "GitHub classic branch endpoint reported main unprotected with required status enforcement off",
          "verified_at": "2026-09-15T06:26:18.223040+00:00",
          "freshness": "EXPIRING",
          "expires_at": "2026-09-16T06:26:18.223040+00:00"
        }
      ],
      "current_blocker": "Closure Ledger is merged and machine-validated, but main still lacks repository-enforced branch protection under the current plan, enterprise inventory issue #81 remains open, and Command Center/Obsidian do not yet render this ledger as their release truth source.",
      "rollback_reference": "revert the latest Closure Ledger reconciliation commit; no production service mutation is performed by ledger updates"
    },
    {
      "component_id": "release.lane02.infrastructure",
      "lane_id": 2,
      "owner": "Infrastructure Lane Owner",
      "purpose": "VM, Docker, Caddy, DNS, TLS, services, ports, storage, limits and deployment ownership.",
      "location": "foundation-vm and dominion-ops",
      "engineering_state": "BUILT",
      "deployment_state": "DEPLOYED",
      "runtime_state": "UNVERIFIED",
      "customer_state": "NOT_APPLICABLE",
      "commercial_state": "UNVERIFIED",
      "security_state": "UNVERIFIED",
      "recovery_state": "UNVERIFIED",
      "release_stage": "BLOCKED",
      "dependencies": ["release.lane01.truth-governance"],
      "deployed_sha_or_digest": null,
      "last_verified_at": null,
      "evidence_receipts": [],
      "current_blocker": "Fresh full runtime inventory has not yet been reconciled against the approved architecture and canonical service ownership for issue #81.",
      "rollback_reference": null
    },
    {
      "component_id": "release.lane03.security",
      "lane_id": 3,
      "owner": "Security Lane Owner",
      "purpose": "Least privilege, private bindings, auth, credential boundaries, dependency review and negative authorization tests.",
      "location": "dominion-ops and production runtime",
      "engineering_state": "BUILT",
      "deployment_state": "UNVERIFIED",
      "runtime_state": "UNVERIFIED",
      "customer_state": "NOT_APPLICABLE",
      "commercial_state": "NOT_APPLICABLE",
      "security_state": "BLOCKED",
      "recovery_state": "UNVERIFIED",
      "release_stage": "BLOCKED",
      "dependencies": ["release.lane01.truth-governance", "release.lane02.infrastructure"],
      "deployed_sha_or_digest": null,
      "last_verified_at": null,
      "evidence_receipts": [],
      "current_blocker": "Repository main remains without enforced branch protection under the current private-repository plan; release-wide external exposure and authorization-negative certification are incomplete; the Foundation VM trust anchor is now enrolled, but older VM workflows still require migration away from runtime ssh-keyscan.",
      "rollback_reference": null
    },
    {
      "component_id": "release.lane04.ai-orchestration",
      "lane_id": 4,
      "owner": "AI and Orchestration Lane Owner",
      "purpose": "DeerFlow, Nemotron, Conductor, Governor, Council, Buddy, agents and tools operate under one governed authority.",
      "location": "dominion-ops and foundation-vm",
      "engineering_state": "BUILT",
      "deployment_state": "DEPLOYED",
      "runtime_state": "UNVERIFIED",
      "customer_state": "NOT_APPLICABLE",
      "commercial_state": "UNVERIFIED",
      "security_state": "UNVERIFIED",
      "recovery_state": "UNVERIFIED",
      "release_stage": "BLOCKED",
      "dependencies": ["release.lane01.truth-governance", "release.lane02.infrastructure", "release.lane03.security"],
      "deployed_sha_or_digest": null,
      "last_verified_at": null,
      "evidence_receipts": [],
      "current_blocker": "DeerFlow/Nemotron is proven separately, but full Buddy #101 dual-resident production readiness, multi-capability execution, controlled fallback, durable memory reconciliation, backup/restore and prohibited-mission denial remain uncertified.",
      "rollback_reference": null
    },
    {
      "component_id": "release.lane05.automation",
      "lane_id": 5,
      "owner": "Automation Lane Owner",
      "purpose": "n8n, systemd, GitHub Actions and recurring jobs follow one scheduler ownership and receipt policy.",
      "location": "dominion-ops and production runtime",
      "engineering_state": "BUILT",
      "deployment_state": "DEPLOYED",
      "runtime_state": "UNVERIFIED",
      "customer_state": "NOT_APPLICABLE",
      "commercial_state": "UNVERIFIED",
      "security_state": "UNVERIFIED",
      "recovery_state": "UNVERIFIED",
      "release_stage": "BLOCKED",
      "dependencies": ["release.lane01.truth-governance", "release.lane02.infrastructure"],
      "deployed_sha_or_digest": null,
      "last_verified_at": null,
      "evidence_receipts": [],
      "current_blocker": "Complete scheduler inventory with owner, cadence, authority, receipt and failure route is not yet reconciled across n8n, systemd and GitHub Actions.",
      "rollback_reference": null
    },
    {
      "component_id": "release.lane06.voltedge-commerce",
      "lane_id": 6,
      "owner": "Commerce Lane Owner",
      "purpose": "Professional public store, normal catalog SKU, cart, shipping, checkout, payment, receipt, fulfillment, support and refund.",
      "location": "VoltEdge Wix production site",
      "engineering_state": "BUILT",
      "deployment_state": "DEPLOYED",
      "runtime_state": "VERIFIED",
      "customer_state": "UNVERIFIED",
      "commercial_state": "BLOCKED",
      "security_state": "UNVERIFIED",
      "recovery_state": "UNVERIFIED",
      "release_stage": "BLOCKED",
      "dependencies": ["release.lane02.infrastructure", "release.lane03.security", "release.lane07.financial-truth", "release.lane08.attribution-analytics"],
      "deployed_sha_or_digest": null,
      "last_verified_at": "2026-09-15T05:46:17+00:00",
      "evidence_receipts": [
        {
          "receipt_id": "voltedge-gate-cd-20260915",
          "kind": "immutable_provider_transaction_receipt",
          "reference": "Issue #305 Gate C/D production evidence: order 10001 paid, receipt created/sent, automatic $1 refund SUCCEEDED and order FULLY_REFUNDED",
          "verified_at": "2026-09-15T05:46:17+00:00",
          "freshness": "IMMUTABLE",
          "expires_at": null
        }
      ],
      "current_blocker": "Payment-provider readiness and the $1 canary/refund are proven, but the normal Catalog V3 product path has not yet been end-to-end commercially certified with exact attribution and fulfillment evidence.",
      "rollback_reference": null
    },
    {
      "component_id": "release.lane07.financial-truth",
      "lane_id": 7,
      "owner": "Financial Truth Lane Owner",
      "purpose": "Provider-neutral order ledger, Wix and Stripe adapters, refunds, fees, gross and net revenue reconciliation.",
      "location": "dominion-db, Revenue Runtime and provider adapters",
      "engineering_state": "TESTED",
      "deployment_state": "DEPLOYED",
      "runtime_state": "VERIFIED",
      "customer_state": "NOT_APPLICABLE",
      "commercial_state": "BLOCKED",
      "security_state": "UNVERIFIED",
      "recovery_state": "UNVERIFIED",
      "release_stage": "BLOCKED",
      "dependencies": ["release.lane01.truth-governance", "release.lane06.voltedge-commerce", "runtime.revenue-snapshot", "deploy.revenue-commercial-runtime"],
      "deployed_sha_or_digest": "a2fdc5eb628df8eace2186a13450e62c43076524",
      "last_verified_at": "2026-09-15T17:23:30+00:00",
      "evidence_receipts": [
        {
          "receipt_id": "gate-b-runtime-run-34939914069",
          "kind": "production_runtime_receipt",
          "reference": "Empire Status Snapshot run 34939914069: canonical dominion-db.orders provenance PASS and purchase_count=0 revenue_cents=0 receipt PASS",
          "verified_at": "2026-09-15T07:05:33+00:00",
          "freshness": "EXPIRING",
          "expires_at": "2026-09-16T07:05:33+00:00"
        },
        {
          "receipt_id": "revenue-attribution-pr331-merged",